{
  "$schema": "https://json-schema.org/draft/2020-12/schema",
  "$id": "urn:moirae:accord-02e4r3:canonicalization-profile:0.2",
  "profile_id": "urn:moirae:accord-02e4r3:canonicalization-profile",
  "profile_version": "0.2",
  "method": "RFC8785_JCS",
  "encoding": "UTF-8",
  "algorithm": "SHA-256",
  "content_target_registry": [
    {
      "content_target_id": "RECORD_EXCLUDING_INTEGRITY_CONTENT_DIGEST",
      "operator_id": "RECORD_EXCLUDING_INTEGRITY_CONTENT_DIGEST",
      "mode": "EXCLUDE_JSON_POINTERS",
      "json_pointers": [
        "/integrity/content_digest"
      ],
      "pointer_semantics": "RFC6901",
      "missing_pointer_policy": "ERROR",
      "duplicate_pointer_policy": "ERROR",
      "result_type": "JSON_VALUE"
    },
    {
      "content_target_id": "RECORD_EXCLUDING_INTEGRITY",
      "operator_id": "RECORD_EXCLUDING_INTEGRITY",
      "mode": "EXCLUDE_JSON_POINTERS",
      "json_pointers": [
        "/integrity"
      ],
      "pointer_semantics": "RFC6901",
      "missing_pointer_policy": "ERROR",
      "duplicate_pointer_policy": "ERROR",
      "result_type": "JSON_VALUE"
    },
    {
      "content_target_id": "ENTRY_CONTENT",
      "operator_id": "ENTRY_CONTENT",
      "mode": "INCLUDE_JSON_POINTERS",
      "json_pointers": [
        "/content"
      ],
      "pointer_semantics": "RFC6901",
      "missing_pointer_policy": "ERROR",
      "duplicate_pointer_policy": "ERROR",
      "result_type": "JSON_VALUE"
    }
  ],
  "applies_to": [
    {
      "container_type": "VERIFIER_RECORD_ENTRY",
      "schema_id": "urn:moirae:accord-02a:schema:portable-record:0.2",
      "schema_version": "0.2",
      "record_types": [
        "PORTABLE_BUNDLE",
        "PRINCIPAL",
        "AUTHORITY_GRANT",
        "INTENT",
        "TASK",
        "DELEGATION",
        "EFFECT_ATTEMPT",
        "EFFECT_OBSERVATION",
        "EVIDENCE_ARTIFACT"
      ],
      "content_target_id": "ENTRY_CONTENT",
      "canonicalization_profile_ref": {
        "reference_kind": "CONTRACT",
        "contract_id": "urn:moirae:accord-02e4r3:canonicalization-profile",
        "contract_version": "0.2"
      }
    },
    {
      "container_type": "VERIFIER_RECORD_ENTRY",
      "schema_id": "urn:moirae:accord-02a:schema:verifier-result:0.2",
      "schema_version": "0.2",
      "record_types": [
        "VERIFIER_RESULT"
      ],
      "content_target_id": "ENTRY_CONTENT",
      "canonicalization_profile_ref": {
        "reference_kind": "CONTRACT",
        "contract_id": "urn:moirae:accord-02e4r3:canonicalization-profile",
        "contract_version": "0.2"
      }
    },
    {
      "container_type": "VERIFIER_RECORD_ENTRY",
      "schema_id": "urn:moirae:accord-02b:schema:authority-profile:0.1",
      "schema_version": "0.1",
      "record_types": [
        "AUTHORITY_PROFILE"
      ],
      "content_target_id": "ENTRY_CONTENT",
      "canonicalization_profile_ref": {
        "reference_kind": "CONTRACT",
        "contract_id": "urn:moirae:accord-02e4r3:canonicalization-profile",
        "contract_version": "0.2"
      }
    },
    {
      "container_type": "VERIFIER_RECORD_ENTRY",
      "schema_id": "urn:moirae:accord-02b:schema:authority-relation-result:0.1",
      "schema_version": "0.1",
      "record_types": [
        "AUTHORITY_ANALYSIS_RESULT"
      ],
      "content_target_id": "ENTRY_CONTENT",
      "canonicalization_profile_ref": {
        "reference_kind": "CONTRACT",
        "contract_id": "urn:moirae:accord-02e4r3:canonicalization-profile",
        "contract_version": "0.2"
      }
    },
    {
      "container_type": "VERIFIER_RECORD_ENTRY",
      "schema_id": "urn:moirae:accord-02e4r2:schema:settlement-profile:0.2",
      "schema_version": "0.2",
      "record_types": [
        "SETTLEMENT_PROFILE"
      ],
      "content_target_id": "ENTRY_CONTENT",
      "canonicalization_profile_ref": {
        "reference_kind": "CONTRACT",
        "contract_id": "urn:moirae:accord-02e4r3:canonicalization-profile",
        "contract_version": "0.2"
      }
    },
    {
      "container_type": "VERIFIER_RECORD_ENTRY",
      "schema_id": "urn:moirae:accord-02c:schema:settlement-result:0.2",
      "schema_version": "0.2",
      "record_types": [
        "SETTLEMENT_RESULT"
      ],
      "content_target_id": "ENTRY_CONTENT",
      "canonicalization_profile_ref": {
        "reference_kind": "CONTRACT",
        "contract_id": "urn:moirae:accord-02e4r3:canonicalization-profile",
        "contract_version": "0.2"
      }
    },
    {
      "container_type": "VERIFIER_RECORD_ENTRY",
      "schema_id": "urn:moirae:accord-02r1:schema:settlement-vocabulary-map:0.1",
      "schema_version": "0.1",
      "record_types": [
        "PROJECTION_PROFILE"
      ],
      "content_target_id": "ENTRY_CONTENT",
      "canonicalization_profile_ref": {
        "reference_kind": "CONTRACT",
        "contract_id": "urn:moirae:accord-02e4r3:canonicalization-profile",
        "contract_version": "0.2"
      }
    },
    {
      "container_type": "VERIFIER_RECORD_ENTRY",
      "schema_id": "urn:moirae:accord-02r2:schema:effect-proposition:0.1",
      "schema_version": "0.1",
      "record_types": [
        "effect_proposition"
      ],
      "content_target_id": "RECORD_EXCLUDING_INTEGRITY_CONTENT_DIGEST",
      "canonicalization_profile_ref": {
        "reference_kind": "CONTRACT",
        "contract_id": "urn:moirae:accord-02e4r3:canonicalization-profile",
        "contract_version": "0.2"
      }
    },
    {
      "container_type": "VERIFIER_RECORD_ENTRY",
      "schema_id": "urn:moirae:accord-02r3:schema:verifier-run:0.1",
      "schema_version": "0.1",
      "record_types": [
        "VERIFIER_RUN"
      ],
      "content_target_id": "ENTRY_CONTENT",
      "canonicalization_profile_ref": {
        "reference_kind": "CONTRACT",
        "contract_id": "urn:moirae:accord-02e4r3:canonicalization-profile",
        "contract_version": "0.2"
      }
    },
    {
      "container_type": "VERIFIER_RECORD_ENTRY",
      "schema_id": "urn:moirae:accord-02r3:schema:extension-registry:0.1",
      "schema_version": "0.1",
      "record_types": [
        "EXTENSION_REGISTRY"
      ],
      "content_target_id": "ENTRY_CONTENT",
      "canonicalization_profile_ref": {
        "reference_kind": "CONTRACT",
        "contract_id": "urn:moirae:accord-02e4r3:canonicalization-profile",
        "contract_version": "0.2"
      }
    },
    {
      "container_type": "VERIFIER_RECORD_ENTRY",
      "schema_id": "urn:moirae:accord-02r3:schema:predicate-applicability-profile:0.1",
      "schema_version": "0.1",
      "record_types": [
        "PREDICATE_APPLICABILITY_PROFILE"
      ],
      "content_target_id": "ENTRY_CONTENT",
      "canonicalization_profile_ref": {
        "reference_kind": "CONTRACT",
        "contract_id": "urn:moirae:accord-02e4r3:canonicalization-profile",
        "contract_version": "0.2"
      }
    },
    {
      "container_type": "EXPERIMENT_RECORD_ENTRY",
      "schema_id": "urn:moirae:accord-02a:schema:portable-record:0.2",
      "schema_version": "0.2",
      "record_types": [
        "PORTABLE_BUNDLE",
        "PRINCIPAL",
        "AUTHORITY_GRANT",
        "INTENT",
        "TASK",
        "DELEGATION",
        "EFFECT_ATTEMPT",
        "EFFECT_OBSERVATION",
        "EVIDENCE_ARTIFACT"
      ],
      "content_target_id": "ENTRY_CONTENT",
      "canonicalization_profile_ref": {
        "reference_kind": "CONTRACT",
        "contract_id": "urn:moirae:accord-02e4r3:canonicalization-profile",
        "contract_version": "0.2"
      }
    },
    {
      "container_type": "EXPERIMENT_RECORD_ENTRY",
      "schema_id": "urn:moirae:accord-02a:schema:verifier-result:0.2",
      "schema_version": "0.2",
      "record_types": [
        "VERIFIER_RESULT"
      ],
      "content_target_id": "ENTRY_CONTENT",
      "canonicalization_profile_ref": {
        "reference_kind": "CONTRACT",
        "contract_id": "urn:moirae:accord-02e4r3:canonicalization-profile",
        "contract_version": "0.2"
      }
    },
    {
      "container_type": "EXPERIMENT_RECORD_ENTRY",
      "schema_id": "urn:moirae:accord-02b:schema:authority-profile:0.1",
      "schema_version": "0.1",
      "record_types": [
        "AUTHORITY_PROFILE"
      ],
      "content_target_id": "ENTRY_CONTENT",
      "canonicalization_profile_ref": {
        "reference_kind": "CONTRACT",
        "contract_id": "urn:moirae:accord-02e4r3:canonicalization-profile",
        "contract_version": "0.2"
      }
    },
    {
      "container_type": "EXPERIMENT_RECORD_ENTRY",
      "schema_id": "urn:moirae:accord-02b:schema:authority-relation-result:0.1",
      "schema_version": "0.1",
      "record_types": [
        "AUTHORITY_ANALYSIS_RESULT"
      ],
      "content_target_id": "ENTRY_CONTENT",
      "canonicalization_profile_ref": {
        "reference_kind": "CONTRACT",
        "contract_id": "urn:moirae:accord-02e4r3:canonicalization-profile",
        "contract_version": "0.2"
      }
    },
    {
      "container_type": "EXPERIMENT_RECORD_ENTRY",
      "schema_id": "urn:moirae:accord-02e4r2:schema:settlement-profile:0.2",
      "schema_version": "0.2",
      "record_types": [
        "SETTLEMENT_PROFILE"
      ],
      "content_target_id": "ENTRY_CONTENT",
      "canonicalization_profile_ref": {
        "reference_kind": "CONTRACT",
        "contract_id": "urn:moirae:accord-02e4r3:canonicalization-profile",
        "contract_version": "0.2"
      }
    },
    {
      "container_type": "EXPERIMENT_RECORD_ENTRY",
      "schema_id": "urn:moirae:accord-02c:schema:settlement-result:0.2",
      "schema_version": "0.2",
      "record_types": [
        "SETTLEMENT_RESULT"
      ],
      "content_target_id": "ENTRY_CONTENT",
      "canonicalization_profile_ref": {
        "reference_kind": "CONTRACT",
        "contract_id": "urn:moirae:accord-02e4r3:canonicalization-profile",
        "contract_version": "0.2"
      }
    },
    {
      "container_type": "EXPERIMENT_RECORD_ENTRY",